{
  "id": "atk_slime_golpe",
  "versao": 1,
  "nome_txt": "txt_atk_slime_golpe_nome",
  "tipo": "ataque",
  "efeito": "dano",
  "alvo_tipo": "inimigo_1",
  "custo": {
    "mana": 0
  },
  "dano_base": 12,
  "atributo": "forca",
  "escala": 5,
  "tipo_dano": "impacto",
  "tempo": "t_atacar",
  "pose": "bat_ataque",
  "fx": "fx_impacto_leve",
  "sfx": "sfx_impacto_leve"
}
