{
  "id": "atk_hollowpaw_pancada",
  "versao": 1,
  "nota": "Hollowpaw (boss_urso_musgo), ataque básico: pancada de pata em um herói. Ficha: docs/sistemas/ficha_hollowpaw.md.",
  "nome_txt": "txt_atk_hollowpaw_pancada_nome",
  "tipo": "ataque",
  "efeito": "dano",
  "alvo_tipo": "inimigo_1",
  "custo": {
    "mana": 0
  },
  "dano_base": 22,
  "atributo": "forca",
  "escala": 5,
  "tipo_dano": "impacto",
  "tempo": "t_atacar",
  "pose": "bat_ataque",
  "fx": "fx_impacto_medio",
  "sfx": "sfx_impacto_medio"
}
